sku,descricao,gross_price,price,pagamento,date,day,hour
20995,English Bluebell Yardley Perfume Feminino Eau de Toilette,"136,00","68,00","2x de R$ 34,00",2020-05-06 21:15:09.934161,05/06/20,21:15:09
4196,La Vie Est Belle Lancôme - Perfume Feminino - Eau de Parfum,,"298,90","9x de R$ 33,21",2020-05-06 21:15:09.934161,05/06/20,21:15:09
13731,Good Girl Carolina Herrera - Perfume Feminino - Eau de Parfum,,"298,90","9x de R$ 33,21",2020-05-06 21:15:09.934161,05/06/20,21:15:09
9206,La Petite Fleur blanche Paris Elysees - Perfume Feminino - Eau de Toilette,"73,80","64,90","2x de R$ 32,45",2020-05-06 21:15:09.934161,05/06/20,21:15:09
8357,Cuté Woman La Rive - Perfume Feminino - Eau de Parfum,"39,90","33,92",,2020-05-06 21:15:09.934161,05/06/20,21:15:09
33521,Idôle Lancôme - Perfume Feminino Eau de Parfum,,"258,90","8x de R$ 32,36",2020-05-06 21:15:09.934161,05/06/20,21:15:09
20659,Queen of Life La Rive Perfume Feminino - Eau de Parfum,"39,90","33,80",,2020-05-06 21:15:09.934161,05/06/20,21:15:09
17649,Mademoiselle L’Eau Très Belle Azzaro - Perfume Feminino Eau de Toilette,"218,90","99,00","3x de R$ 33,00",2020-05-06 21:15:09.934161,05/06/20,21:15:09
5686,212 VIP Rosé Carolina Herrera - Perfume Feminino - Eau de Parfum,,"398,90","10x de R$ 39,89",2020-05-06 21:15:09.934161,05/06/20,21:15:09
3975,Amor Amor Cacharel - Perfume Feminino - Eau de Toilette,,"159,00","5x de R$ 31,80",2020-05-06 21:15:09.934161,05/06/20,21:15:09
39209,Good Girl Fantastic Pink Carolina Herrera Perfume Feminino EDP,,"529,00","10x de R$ 52,90",2020-05-06 21:15:09.934161,05/06/20,21:15:09
34215,Taste of Kiss La Rive Perfume Feminino - Eau de Parfum,"69,90","60,80","2x de R$ 30,40",2020-05-06 21:15:09.934161,05/06/20,21:15:09
29476,Mademoiselle L’Eau Très Florale Azzaro - Perfume Feminino - Eau de Toilette,"218,90","114,90","3x de R$ 38,30",2020-05-06 21:15:09.934161,05/06/20,21:15:09
27531,Sweet Hope La Rive - Perfume Feminino - Eau de Parfum,"69,90","53,90",,2020-05-06 21:15:09.934161,05/06/20,21:15:09
25018,Fleur de Femme La Rive Perfume Feminino - Eau de Parfum,"69,90","56,90",,2020-05-06 21:15:09.934161,05/06/20,21:15:09
25017,In Flames La Rive Perfume Feminino - Eau de Parfum,"69,90","57,90",,2020-05-06 21:15:09.934161,05/06/20,21:15:09
25016,Aqua Bella La Rive Perfume Feminino - Eau de Parfum,"69,90","56,90",,2020-05-06 21:15:09.934161,05/06/20,21:15:09
20959,Lady Million Lucky Paco Rabanne - Perfume feminino - Eau de Parfum,"298,90","199,00","6x de R$ 33,16",2020-05-06 21:15:09.934161,05/06/20,21:15:09
20479,Aura Mugler Perfume Feminino - Eau de Parfum,"318,90","238,79","7x de R$ 34,11",2020-05-06 21:15:09.934161,05/06/20,21:15:09
17715,Woman Ralph Lauren Perfume Feminino - Eau de Parfum,"298,90","253,80","8x de R$ 31,72",2020-05-06 21:15:09.934161,05/06/20,21:15:09
17683,Miss Dior Dior Perfume Feminino - Eau de Parfum,,"299,00","9x de R$ 33,22",2020-05-06 21:15:09.934161,05/06/20,21:15:09
14550,Lumière Fiorucci - Perfume Feminino - Eau de Parfum,,"54,90",,2020-05-06 21:15:09.934161,05/06/20,21:15:09
13496,In Woman La Rive - Perfume Feminino - Eau de Parfum,"39,90","33,92",,2020-05-06 21:15:09.934161,05/06/20,21:15:09
10758,Olympéa Paco Rabanne - Perfume Feminino - Eau de Parfum,,"298,90","9x de R$ 33,21",2020-05-06 21:15:09.934161,05/06/20,21:15:09
9410,Nuit Rose Limited Edition Fiorucci - Perfume Feminino - Deo Colônia,,"37,80",,2020-05-06 21:15:09.934161,05/06/20,21:15:09
9202,La Petite Fleur d’amour Paris Elysees - Perfume Feminino - Eau de Toilette,"72,80","59,00",,2020-05-06 21:15:09.934161,05/06/20,21:15:09
8574,La Nuit Trésor Lancôme - Perfume Feminino - Eau de Parfum,"288,90","229,79","7x de R$ 32,82",2020-05-06 21:15:09.934161,05/06/20,21:15:09
8323,Ebon Pour Femme I-Scents - Perfume Feminino - Eau de Parfum,"37,80","32,13",,2020-05-06 21:15:09.934161,05/06/20,21:15:09
6515,Vodka Love Paris Elysees - Perfume Feminino - Eau de Toilette,"69,00","51,80",,2020-05-06 21:15:09.934161,05/06/20,21:15:09
5919,Si Giorgio Armani - Perfume Feminino - Eau de Parfum,,"298,90","9x de R$ 33,21",2020-05-06 21:15:09.934161,05/06/20,21:15:09
3247,Chloé Chloe - Perfume Feminino - Eau de Parfum,"529,00","422,90","10x de R$ 42,29",2020-05-06 21:15:09.934161,05/06/20,21:15:09
3216,CH Carolina Herrera - Perfume Feminino - Eau de Toilette,,"308,90","10x de R$ 30,89",2020-05-06 21:15:09.934161,05/06/20,21:15:09
2950,Billion Woman Paris Elysees - Perfume Feminino - Eau de Toilette,"69,00","54,80",,2020-05-06 21:15:09.934161,05/06/20,21:15:09
2852,Be Delicious Dkny - Perfume Feminino -  Eau de Parfum,,"289,00","9x de R$ 32,11",2020-05-06 21:15:09.934161,05/06/20,21:15:09
796,Lady Million Paco Rabanne - Perfume Feminino - Eau de Parfum,,"298,90","9x de R$ 33,21",2020-05-06 21:15:09.934161,05/06/20,21:15:09
618,J'adore Dior - Perfume Feminino - Eau de Parfum,,"459,00","10x de R$ 45,90",2020-05-06 21:15:09.934161,05/06/20,21:15:09
38871,Libre Yves Saint Laurent Perfume Feminino - Eau de Parfum,,"299,00","9x de R$ 33,22",2020-05-06 21:15:09.934161,05/06/20,21:15:09
38558,Lady Million Empire Paco Rabanne Perfume Feminino EDP,,"299,00","9x de R$ 33,22",2020-05-06 21:15:09.934161,05/06/20,21:15:09
36593,Hello Hello by Nah Cardoso Ciclo Cosméticos - Perfume Feminino EDC,"69,90","59,42",,2020-05-06 21:15:09.934161,05/06/20,21:15:09
35472,Aura Sensuelle Mugler Perfume Feminino - Eau de Parfum,"349,00","296,65","9x de R$ 32,96",2020-05-06 21:15:09.934161,05/06/20,21:15:09
34735,Mon Guerlain - Perfume Feminino Eau de Parfum,,"264,90","8x de R$ 33,11",2020-05-06 21:15:09.934161,05/06/20,21:15:09
34214,In Woman Red La Rive Perfume Feminino - Eau de Parfum,"69,90","58,80",,2020-05-06 21:15:09.934161,05/06/20,21:15:09
33343,Miss Dior Roller Pearl Dior Perfume Feminino - Eau de Toilette,,"169,00","5x de R$ 33,80",2020-05-06 21:15:09.934161,05/06/20,21:15:09
31152,Her Secret Desire Antonio Banderas Perfume Feminino - Eau de Toilette,"99,00","79,89","2x de R$ 39,94",2020-05-06 21:15:09.934161,05/06/20,21:15:09
30300,Black Opium Glow Yves Saint Laurent Perfume Feminino - Eau de Toilette,,"398,90","10x de R$ 39,89",2020-05-06 21:15:09.934161,05/06/20,21:15:09
24612,Cash Woman La Rive Perfume Feminino - Eau de Parfum,"39,90","33,92",,2020-05-06 21:15:09.934161,05/06/20,21:15:09
24611,In Love La Rive Perfume Feminino - Eau de Parfum,"69,90","59,80",,2020-05-06 21:15:09.934161,05/06/20,21:15:09
22019,Cedro do Marrocos Phebo Deo Colônia Feminino,,"49,90",,2020-05-06 21:15:09.934161,05/06/20,21:15:09
22019,Cedro do Marrocos Phebo Deo Colônia Feminino,,"49,90",,2020-05-06 21:15:09.934161,05/06/20,21:15:09
21440,Yes I Am Cacharel - Perfume Feminino - Eau de Parfum,,"258,80","8x de R$ 32,35",2020-05-06 21:15:09.934161,05/06/20,21:15:09
20987,White Tea Elizabeth Arden - Perfume Feminino - Eau de Toilette,"119,00","101,15","3x de R$ 33,71",2020-05-06 21:15:09.934161,05/06/20,21:15:09
20122,Queen Of Seduction Absolute Diva Antonio Banderas Perfume Feminino - EDT,"149,00","89,80","2x de R$ 44,90",2020-05-06 21:15:09.934161,05/06/20,21:15:09
19885,Gold Royale I-Scents Perfume Feminino - Eau de Parfum,"42,90","38,61",,2020-05-06 21:15:09.934161,05/06/20,21:15:09
19017,La Petite Fleur Romantique Paris Elysees Perfume Feminino - Eau de Toilette,"74,00","55,50",,2020-05-06 21:15:09.934161,05/06/20,21:15:09
18904,Moschino Pink Fresh Couture - Perfume Feminino - Eau de Toilette,"373,00","199,00","6x de R$ 33,16",2020-05-06 21:15:09.934161,05/06/20,21:15:09
18513,Hello Beauty La Rive Perfume Feminino - Eau de Parfum,"69,90","54,80",,2020-05-06 21:15:09.934161,05/06/20,21:15:09
17723,Black Opium Yves Saint Laurent - Perfume Feminino Eau de Parfum,,"298,90","9x de R$ 33,21",2020-05-06 21:15:09.934161,05/06/20,21:15:09
13771,Miss Dior Absolutely Blooming Dior - Perfume Feminino - Eau de Parfum,,"299,00","9x de R$ 33,22",2020-05-06 21:15:09.934161,05/06/20,21:15:09
9421,Paris Fiorucci - Perfume Feminino - Deo Colônia,"49,90","39,92",,2020-05-06 21:15:09.934161,05/06/20,21:15:09
8440,Diamond Lonkoom - Perfume Feminino - Eau de Parfum,,"94,90","3x de R$ 31,63",2020-05-06 21:15:09.934161,05/06/20,21:15:09
6569,Royal Marina Diamond Marina de Bourbon - Perfume Feminino - Eau de Parfum,"221,00","176,70","5x de R$ 35,34",2020-05-06 21:15:09.934161,05/06/20,21:15:09
4614,Classic Jeans Forum - Perfume Unissex - Eau de Cologne,"69,90","55,92",,2020-05-06 21:15:09.934161,05/06/20,21:15:09
4150,Hypnôse Lancôme - Perfume Feminino - Eau de Parfum,,"348,90","10x de R$ 34,89",2020-05-06 21:15:09.934161,05/06/20,21:15:09
3120,Cabotine de Grès Gres - Perfume Feminino - Eau de Toilette,"169,90","101,94","3x de R$ 33,98",2020-05-06 21:15:09.934161,05/06/20,21:15:09
2984,Black Caviar Woman Paris Elysees - Perfume Feminino - Eau de Toilette,"69,00","58,90",,2020-05-06 21:15:09.934161,05/06/20,21:15:09
2657,Ange ou Démon Givenchy - Perfume Feminino - Eau de Parfum,"288,90","242,79","8x de R$ 30,34",2020-05-06 21:15:09.934161,05/06/20,21:15:09
2647,Amour Toujours Paris Elysees - Perfume Feminino - Eau de Toilette,"69,00","56,80",,2020-05-06 21:15:09.934161,05/06/20,21:15:09
2561,212 Vip Carolina Herrera - Perfume Feminino - Eau de Parfum,,"288,90","9x de R$ 32,10",2020-05-06 21:15:09.934161,05/06/20,21:15:09
2555,212 Sexy Carolina Herrera - Perfume Feminino - Eau de Parfum,,"278,90","9x de R$ 30,98",2020-05-06 21:15:09.934161,05/06/20,21:15:09
2551,212 NYC Carolina Herrera - Perfume Feminino - Eau de Toilette,,"278,90","9x de R$ 30,98",2020-05-06 21:15:09.934161,05/06/20,21:15:09
1837,Rouge Royal Marina de Bourbon - Perfume Feminino - Eau de Parfum,"219,00","140,70","4x de R$ 35,17",2020-05-06 21:15:09.934161,05/06/20,21:15:09
1159,Midnight Fantasy Britney Spears - Perfume Feminino - Eau de Parfum,"284,00","218,68","7x de R$ 31,24",2020-05-06 21:15:09.934161,05/06/20,21:15:09
909,Light Blue Dolce&Gabbana - Perfume Feminino - Eau de Toilette,"275,80","234,43","7x de R$ 33,49",2020-05-06 21:15:09.934161,05/06/20,21:15:09
812,Laloa Sexy Via Paris - Perfume Feminino - Eau de Toilette,"53,00","39,00",,2020-05-06 21:15:09.934161,05/06/20,21:15:09
330,Gucci Guilty Gucci - Perfume Feminino - Eau de Toilette,"298,90","253,80","8x de R$ 31,72",2020-05-06 21:15:09.934161,05/06/20,21:15:09
38167,JOY Intense By Dior Perfume Feminino – Eau de Parfum,,"459,00","10x de R$ 45,90",2020-05-06 21:15:09.934161,05/06/20,21:15:09
38044,My Delicate La Rive – Perfume Feminino Eau de Parfum,"69,90","59,42",,2020-05-06 21:15:09.934161,05/06/20,21:15:09
37065,Nina Rouge Nina Ricci Perfume Feminino - Eau de Toilette,,"228,80","7x de R$ 32,68",2020-05-06 21:15:09.934161,05/06/20,21:15:09
36219,Woman Intense Ralph Lauren - Perfume Feminino Eau de Parfum,"398,80","299,79","9x de R$ 33,31",2020-05-06 21:15:09.934161,05/06/20,21:15:09
35796,Burberry Her Blossom Burberry Perfume Feminino - Eau de Toilette,"268,90","225,80","7x de R$ 32,25",2020-05-06 21:15:09.934161,05/06/20,21:15:09
35796,Burberry Her Blossom Burberry Perfume Feminino - Eau de Toilette,"268,90","225,80","7x de R$ 32,25",2020-05-06 21:15:09.934161,05/06/20,21:15:09
34764,Terracotta Le Parfum Guerlain - Perfume Feminino Eau de Toilette,,"359,90","10x de R$ 35,99",2020-05-06 21:15:09.934161,05/06/20,21:15:09
34739,Mon Guerlain Bloom Of Rose - Perfume Feminino Eau de Toilette,,"230,00","7x de R$ 32,85",2020-05-06 21:15:09.934161,05/06/20,21:15:09
34734,Aqua Allegoria Ginger Piccante Guerlain - Perfume Feminino Eau de Toilette,,"334,90","10x de R$ 33,49",2020-05-06 21:15:09.934161,05/06/20,21:15:09
34729,Aqua Allegoria Pera Granita Guerlain - Perfume Feminino Eau de Toilette,,"334,90","10x de R$ 33,49",2020-05-06 21:15:09.934161,05/06/20,21:15:09
34728,Aqua Allegoria Limon Verde Guerlain - Perfume Feminino Eau de Toilette,,"334,90","10x de R$ 33,49",2020-05-06 21:15:09.934161,05/06/20,21:15:09
32883,Olympéa Legend Paco Rabanne Perfume Feminino - Eau de Parfum,,"398,90","10x de R$ 39,89",2020-05-06 21:15:09.934161,05/06/20,21:15:09
31685,J’adore Roller Pearl Dior Perfume Feminino - Eau de Parfum,,"199,00","6x de R$ 33,16",2020-05-06 21:15:09.934161,05/06/20,21:15:09
30398,Dolce & Sense Vanille/Framboise Paris Elysees Perfume Feminino - Eau de Parfum,"49,90","42,42",,2020-05-06 21:15:09.934161,05/06/20,21:15:09
29707,Romantic Glamour Paris Elysees - Perfume Feminino - Eau de Parfum,"74,00","55,50",,2020-05-06 21:15:09.934161,05/06/20,21:15:09
27626,Real Time Wonderful Woman - Perfume Feminino Eau de Parfum,"59,00","47,20",,2020-05-06 21:15:09.934161,05/06/20,21:15:09
27349,Paris La Nuit Fiorucci Perfume Feminino - Deo Colônia,,"49,90",,2020-05-06 21:15:09.934161,05/06/20,21:15:09
25203,Sì Passione Giorgio Armani Perfume Feminino - Eau de Parfum,,"448,90","10x de R$ 44,89",2020-05-06 21:15:09.934161,05/06/20,21:15:09
24385,Cristal Royal Passion Marina de Bourbon - Perfume Feminino - Eau de Parfum,"229,00","139,00","4x de R$ 34,75",2020-05-06 21:15:09.934161,05/06/20,21:15:09
24050,Alien Flora Futura Mugler Perfume Feminino - Eau de Toilette,"278,90","199,80","6x de R$ 33,30",2020-05-06 21:15:09.934161,05/06/20,21:15:09
22549,Roller Pearl Dior Miss Dior Blooming Bouquet - Eau de Toilette,,"169,00","5x de R$ 33,80",2020-05-06 21:15:09.934161,05/06/20,21:15:09
20569,Olympéa Aqua Paco Rabanne - Perfume Feminino - Eau de Parfum Légère,,"298,90","9x de R$ 33,21",2020-05-06 21:15:09.934161,05/06/20,21:15:09
19883,Be Beautiful I-Scents Perfume Feminino - Eau de Parfum,"42,90","36,47",,2020-05-06 21:15:09.934161,05/06/20,21:15:09
18905,The One Dolce&Gabbana - Perfume Feminino - Eau de Toilette,"453,90","385,82","10x de R$ 38,58",2020-05-06 21:15:09.934161,05/06/20,21:15:09
18810,Gucci Bloom Gucci - Perfume Feminino - Eau de Parfum,"399,00","309,00","10x de R$ 30,90",2020-05-06 21:15:09.934161,05/06/20,21:15:09
18283,La Vie Est Belle L'Éclat Lancôme - Perfume Feminino - Eau de Parfum,,"298,90","9x de R$ 33,21",2020-05-06 21:15:09.934161,05/06/20,21:15:09
16632,Bamboo Gucci - Perfume Feminino Eau de Parfum,"299,00","249,00","8x de R$ 31,12",2020-05-06 21:15:09.934161,05/06/20,21:15:09
16573,O Desejo Juliana Paes - Perfume Feminino - Deo Colônia,"69,90","59,42",,2020-05-06 21:15:09.934161,05/06/20,21:15:09
15996,Angel Muse Mugler - Perfume Feminino - Eau de Parfum,"348,90","313,90","10x de R$ 31,39",2020-05-06 21:15:09.934161,05/06/20,21:15:09
15992,Olympéa Intense Paco Rabanne - Perfume Feminino - Eau de Parfum,,"328,90","10x de R$ 32,89",2020-05-06 21:15:09.934161,05/06/20,21:15:09
14270,Lady Million Privé Paco Rabanne -  Feminino - Eau de Parfum,,"328,90","10x de R$ 32,89",2020-05-06 21:15:09.934161,05/06/20,21:15:09
13640,Wave For Her Hollister - Perfume Feminino - Eau de Parfum,"169,00","118,90","3x de R$ 39,63",2020-05-06 21:15:09.934161,05/06/20,21:15:09
13492,Secret I-scents - Perfume Feminino - Eau de Parfum,"39,80","33,80",,2020-05-06 21:15:09.934161,05/06/20,21:15:09
13491,Coretan I-scents - Perfume Feminino - Eau de Parfum,"37,80","32,13",,2020-05-06 21:15:09.934161,05/06/20,21:15:09
12843,Apaixonada Phytoderm - Perfume Feminino - Deo Colônia,"25,90","18,13",,2020-05-06 21:15:09.934161,05/06/20,21:15:09
12757,Eau de Lacoste L.12.12 Pour Elle Sparkling Lacoste - Perfume Feminino - Eau de Toilette,"309,00","169,00","5x de R$ 33,80",2020-05-06 21:15:09.934161,05/06/20,21:15:09
11758,Mademoiselle Azzaro - Perfume Feminino - Eau de Toilette,"218,90","149,00","4x de R$ 37,25",2020-05-06 21:15:09.934161,05/06/20,21:15:09
11758,Mademoiselle Azzaro - Perfume Feminino - Eau de Toilette,"218,90","149,00","4x de R$ 37,25",2020-05-06 21:15:09.934161,05/06/20,21:15:09
9408,Majestic Pour Femme Fiorucci - Perfume Feminino - Deo Colônia,,"49,90",,2020-05-06 21:15:09.934161,05/06/20,21:15:09
8581,Anais Anais Premier Delice Cacharel - Perfume Feminino - Eau de Toilette,,"178,80","5x de R$ 35,76",2020-05-06 21:15:09.934161,05/06/20,21:15:09
8333,Madame In Love La Rive - Perfume Feminino - Eau de Parfum,"69,90","56,90",,2020-05-06 21:15:09.934161,05/06/20,21:15:09
8242,Boss Ma Vie Pour Femme Hugo Boss - Perfume Feminino - Eau de Parfum,"429,00","321,75","10x de R$ 32,17",2020-05-06 21:15:09.934161,05/06/20,21:15:09
7561,Classique Marina de Bourbon - Perfume Feminino - Eau de Parfum,"170,00","149,00","4x de R$ 37,25",2020-05-06 21:15:09.934161,05/06/20,21:15:09
5688,Miss Dior Blooming Bouquet Dior - Perfume Feminino - Eau de Toilette,,"279,00","9x de R$ 31,00",2020-05-06 21:15:09.934161,05/06/20,21:15:09
4253,Pacha Ibiza Rosé Pacha Ibiza - Perfume Feminino - Eau de Toilette,"98,90","79,00","2x de R$ 39,50",2020-05-06 21:15:09.934161,05/06/20,21:15:09
4228,Miracle Lancôme - Perfume Feminino - Eau de Parfum,"428,90","299,80","9x de R$ 33,31",2020-05-06 21:15:09.934161,05/06/20,21:15:09
3984,Amani Code Pour Femme Giorgio Armani - Perfume Feminino - Eau de Parfum,,"438,90","10x de R$ 43,89",2020-05-06 21:15:09.934161,05/06/20,21:15:09
3979,Anais Anais L'Original Cacharel - Perfume Feminino - Eau de Toilette,,"258,80","8x de R$ 32,35",2020-05-06 21:15:09.934161,05/06/20,21:15:09
3965,Acqua Di Gioia Giorgio Armani - Perfume Feminino - Eau de Parfum,,"268,90","8x de R$ 33,61",2020-05-06 21:15:09.934161,05/06/20,21:15:09
3592,Dior Addict Dior - Perfume Feminino - Eau de Parfum,,"299,00","9x de R$ 33,22",2020-05-06 21:15:09.934161,05/06/20,21:15:09
3483,Daniella Sabrini Paris Elysees - Perfume Feminino - Eau de Toilette,"69,00","41,40",,2020-05-06 21:15:09.934161,05/06/20,21:15:09
3307,Classique Jean Paul Gaultier - Perfume Feminino - Eau de Toilette,,"319,00","10x de R$ 31,90",2020-05-06 21:15:09.934161,05/06/20,21:15:09
8324,Belle Pour Femme I-Scents - Perfume Feminino - Eau de Parfum,,"0,00",,2020-05-06 21:15:09.934161,05/06/20,21:15:09
3306,Classique Jean Paul Gaultier - Perfume Feminino - Eau de Parfum,,"298,90","9x de R$ 33,21",2020-05-06 21:15:09.934161,05/06/20,21:15:09
2831,Baiser Volé Cartier - Perfume Feminino - Eau de Parfum,,"670,00","10x de R$ 67,00",2020-05-06 21:15:09.934161,05/06/20,21:15:09
1685,Pure Poison Dior - Perfume Feminino - Eau de Parfum,,"298,90","9x de R$ 33,21",2020-05-06 21:15:09.934161,05/06/20,21:15:09
1345,Number One Paris Elysees - Perfume Unissex - Eau de Toilette,"69,00","59,80",,2020-05-06 21:15:09.934161,05/06/20,21:15:09
1306,Nina Nina Ricci - Perfume Feminino - Eau de Toilette,,"119,00","3x de R$ 39,66",2020-05-06 21:15:09.934161,05/06/20,21:15:09
1195,Miss Vodka Paris Elysees - Perfume Feminino - Eau de Toilette,"69,00","55,20",,2020-05-06 21:15:09.934161,05/06/20,21:15:09
686,Kenzo Amour Kenzo - Perfume Feminino - Eau de Parfum,"249,80","212,33","7x de R$ 30,33",2020-05-06 21:15:09.934161,05/06/20,21:15:09
514,Hypnotic Poison Dior - Perfume Feminino - Eau de Toilette,,"425,00","10x de R$ 42,50",2020-05-06 21:15:09.934161,05/06/20,21:15:09
39217,Olympéa Onyx Paco Rabanne Perfume Feminino EDP,,"499,00","10x de R$ 49,90",2020-05-06 21:15:09.934161,05/06/20,21:15:09
39151,Flower by Kenzo Poppy Bouquet Kenzo Perfume Feminino - EDP,"259,00","220,15","7x de R$ 31,45",2020-05-06 21:15:09.934161,05/06/20,21:15:09
38968,Neon Man Colcci Perfume Feminino EDT,"119,90","101,92","3x de R$ 33,97",2020-05-06 21:15:09.934161,05/06/20,21:15:09
38897,Mon Guerlain Bloom of Rose - Guerlain Perfume Feminino EDP,,"265,00","8x de R$ 33,12",2020-05-06 21:15:09.934161,05/06/20,21:15:09
38820,La Belle Jean Paul Gaultier Perfume Feminino EDP,,"439,00","10x de R$ 43,90",2020-05-06 21:15:09.934161,05/06/20,21:15:09
38791,United Dreams Citrus for Her Benetton – Perfume Feminino EDT,,"119,00","3x de R$ 39,66",2020-05-06 21:15:09.934161,05/06/20,21:15:09
37560,Sky Di Gioia Giorgio Armani - Perfume feminino Eau de Parfum,,"368,80","10x de R$ 36,88",2020-05-06 21:15:09.934161,05/06/20,21:15:09
35843,Angel Eau Croisiere Mugler  Pefume Feminino-Eau de Toillete,"429,00","299,80","9x de R$ 33,31",2020-05-06 21:15:09.934161,05/06/20,21:15:09
34765,Meteorites Le Parfum Guerlain - Perfume Feminino Eau de Toilette,,"359,90","10x de R$ 35,99",2020-05-06 21:15:09.934161,05/06/20,21:15:09
34749,Insolance Guerlain - Perfume Feminino Eau de Toilette,,"299,90","9x de R$ 33,32",2020-05-06 21:15:09.934161,05/06/20,21:15:09
34740,La Petite Robe Noire Guerlain - Perfume Feminino Eau de Toilette,,"250,00","8x de R$ 31,25",2020-05-06 21:15:09.934161,05/06/20,21:15:09
34738,Mon Guerlain - Perfume Feminino Eau de Toilette,,"230,00","7x de R$ 32,85",2020-05-06 21:15:09.934161,05/06/20,21:15:09
34737,Mon Guerlain Florale - Perfume Feminino Eau de Parfum,,"264,90","8x de R$ 33,11",2020-05-06 21:15:09.934161,05/06/20,21:15:09
34733,Aqua Allegoria Flora Cherrysia Guerlain - Perfume Feminino Eau de Toilette,,"334,90","10x de R$ 33,49",2020-05-06 21:15:09.934161,05/06/20,21:15:09
34732,Aqua Allegoria Passiflora Guerlain - Perfume Feminino Eau de Toilette,,"334,90","10x de R$ 33,49",2020-05-06 21:15:09.934161,05/06/20,21:15:09
34731,Aqua Allegoria Pamplelune Guerlain - Perfume Feminino Eau de Toilette,,"334,90","10x de R$ 33,49",2020-05-06 21:15:09.934161,05/06/20,21:15:09
34730,Aqua Allegoria Bergamota Calabria Guerlain - Perfume Feminino Eau de Toilette,,"334,90","10x de R$ 33,49",2020-05-06 21:15:09.934161,05/06/20,21:15:09
34230,Wanted Girl Azzaro - Perfume Feminino Eau de Parfum,"278,90","223,12","7x de R$ 31,87",2020-05-06 21:15:09.934161,05/06/20,21:15:09
34213,Have Fun La Rive Perfume Feminino - Eau de Parfum,"39,90","33,92",,2020-05-06 21:15:09.934161,05/06/20,21:15:09
33148,Animale Seduction Femme Animale - Perfume Feminino - Eau de Parfum,,"169,00","5x de R$ 33,80",2020-05-06 21:15:09.934161,05/06/20,21:15:09
32683,Kenzo World Collector Kenzo Perfume Feminino - Eau de Toilette,"378,90","227,34","7x de R$ 32,47",2020-05-06 21:15:09.934161,05/06/20,21:15:09
32370,Her Golden Secret Antonio Banderas - Perfume Feminino - Eau de Toilette,,"98,90","3x de R$ 32,96",2020-05-06 21:15:09.934161,05/06/20,21:15:09
31898,Majestic Esmeralda Fiorucci Perfume Feminino - Deo Colônia,"49,90","44,91",,2020-05-06 21:15:09.934161,05/06/20,21:15:09
30727,Prerogative Britney Spears - Perfume Feminino Eau de Parfum,"149,00","126,65","4x de R$ 31,66",2020-05-06 21:15:09.934161,05/06/20,21:15:09
30395,Dolce & Sense Muguet Paris Elysees Perfume Feminino - Eau de Parfum,"49,90","37,43",,2020-05-06 21:15:09.934161,05/06/20,21:15:09
30336,La Vida Ciclo Cosméticos Perfume Feminino - Deo Colônia,"59,90","50,92",,2020-05-06 21:15:09.934161,05/06/20,21:15:09
29451,Pure XS For Her Paco Rabanne - Perfume Feminino Eau de Parfum,,"298,90","9x de R$ 33,21",2020-05-06 21:15:09.934161,05/06/20,21:15:09
26390,Jimmy Choo Fever Perfume Feminino Eau de Parfum,"299,00","237,90","7x de R$ 33,98",2020-05-06 21:15:09.934161,05/06/20,21:15:09
25317,La Femme L'Eau Prada -  Perfume Feminino - Eau de Toilette,"318,90","255,12","8x de R$ 31,89",2020-05-06 21:15:09.934161,05/06/20,21:15:09
22385,Lovely Night Puccini Perfume Feminino - Eau de Parfum,"185,00","157,15","5x de R$ 31,43",2020-05-06 21:15:09.934161,05/06/20,21:15:09
22035,Dylan Blue Pour Femme Versace - Perfume Feminino Eau de Parfum,"289,00","245,65","8x de R$ 30,70",2020-05-06 21:15:09.934161,05/06/20,21:15:09
21725,Splendeur Paris Fiorucci - Perfume Feminino - Deo Colônia,"49,90","42,42",,2020-05-06 21:15:09.934161,05/06/20,21:15:09
20576,Coup D’Amour Real Time Perfume Feminino - Eau de Parfum,"59,00","41,30",,2020-05-06 21:15:09.934161,05/06/20,21:15:09
20495,Because it's You She Giorgio Armani Perfume Feminino - Eau de Parfum,,"288,90","9x de R$ 32,10",2020-05-06 21:15:09.934161,05/06/20,21:15:09
19972,Kenzo World Kenzo Perfume Feminino - Eau de Toilette,"328,90","230,23","7x de R$ 32,89",2020-05-06 21:15:09.934161,05/06/20,21:15:09
19203,Dream Ana Hickmann - Perfume Feminino - Deo Colônia,"79,90","51,94",,2020-05-06 21:15:09.934161,05/06/20,21:15:09
18509,She Is Mine La Rive Perfume Feminino - Eau de Parfum,"69,90","54,90",,2020-05-06 21:15:09.934161,05/06/20,21:15:09
18048,Dance Diamonds Shakira - Perfume Feminino Eau de Toilette,,"79,90","2x de R$ 39,95",2020-05-06 21:15:09.934161,05/06/20,21:15:09
18046,Scandal Jean Paul Gaultier - Perfume Feminino Eau de Parfum,,"548,90","10x de R$ 54,89",2020-05-06 21:15:09.934161,05/06/20,21:15:09
17716,Light Blue Pour Femme Intense Dolce&Gabbana Perfume Feminino - Eau de Parfum,"349,00","296,65","9x de R$ 32,96",2020-05-06 21:15:09.934161,05/06/20,21:15:09
17123,Cherry Giovanna Baby Perfume Feminino - Deo Colônia,"50,00","35,00",,2020-05-06 21:15:09.934161,05/06/20,21:15:09
17122,Candy Giovanna Baby Perfume Feminino - Deo Colônia,"50,00","40,00",,2020-05-06 21:15:09.934161,05/06/20,21:15:09
16752,Oui Je T’aime Linn Young - Perfume Femino Eau de Parfum,"92,00","71,90","2x de R$ 35,95",2020-05-06 21:15:09.934161,05/06/20,21:15:09
16520,La Nuit Trésor L’eau de Toilette Lancôme - Perfume Feminino - Eau de Toilette,,"388,90","10x de R$ 38,89",2020-05-06 21:15:09.934161,05/06/20,21:15:09
16401,Sensuelle Ulric de Varens - Perfume Feminino - Eau de Parfum,"109,00","75,90","2x de R$ 37,95",2020-05-06 21:15:09.934161,05/06/20,21:15:09
16028,J'adore Injoy Dior Perfume Feminino Eau de Toilette,,"425,00","10x de R$ 42,50",2020-05-06 21:15:09.934161,05/06/20,21:15:09
15794,Vanilla Blossom Monotheme - Perfume Feminino Eau de Toilette,"149,90","127,42","4x de R$ 31,85",2020-05-06 21:15:09.934161,05/06/20,21:15:09
15656,Splash Alfazema Green Fiorucci - Perfume Feminino - Deo Colônia,"23,90","21,51",,2020-05-06 21:15:09.934161,05/06/20,21:15:09
15466,La Vie Est Belle Intense Lancôme - Perfume Feminino - L’Eau de Parfum,,"398,90","10x de R$ 39,89",2020-05-06 21:15:09.934161,05/06/20,21:15:09
14585,Versace Eros Pour Femme Versace - Perfume Feminino - Eau de Toilette,"239,00","203,15","6x de R$ 33,85",2020-05-06 21:15:09.934161,05/06/20,21:15:09
14193,Shakira Dance Shakira - Perfume Feminino - Eau de Toilette,,"78,90","2x de R$ 39,45",2020-05-06 21:15:09.934161,05/06/20,21:15:09
13959,Narciso Poudree Narciso Rodriguez -  Feminino - Eau de Parfum,"404,80","343,80","10x de R$ 34,38",2020-05-06 21:15:09.934161,05/06/20,21:15:09
