sku,descricao,gross_price,price,pagamento,date,day,hour
9421,Paris Fiorucci - Perfume Feminino - Deo Colônia,"49,90","39,92",,2020-05-07 05:15:08.287308,05/07/20,05:15:08
8440,Diamond Lonkoom - Perfume Feminino - Eau de Parfum,,"94,90","3x de R$ 31,63",2020-05-07 05:15:08.287308,05/07/20,05:15:08
6569,Royal Marina Diamond Marina de Bourbon - Perfume Feminino - Eau de Parfum,"221,00","176,70","5x de R$ 35,34",2020-05-07 05:15:08.287308,05/07/20,05:15:08
6515,Vodka Love Paris Elysees - Perfume Feminino - Eau de Toilette,"69,00","51,80",,2020-05-07 05:15:08.287308,05/07/20,05:15:08
4228,Miracle Lancôme - Perfume Feminino - Eau de Parfum,"428,90","299,80","9x de R$ 33,31",2020-05-07 05:15:08.287308,05/07/20,05:15:08
4150,Hypnôse Lancôme - Perfume Feminino - Eau de Parfum,,"348,90","10x de R$ 34,89",2020-05-07 05:15:08.287308,05/07/20,05:15:08
3120,Cabotine de Grès Gres - Perfume Feminino - Eau de Toilette,"169,90","101,94","3x de R$ 33,98",2020-05-07 05:15:08.287308,05/07/20,05:15:08
3030,Blue Spirit Paris Elysees - Perfume Feminino - Eau de Toilette,"69,00","58,80",,2020-05-07 05:15:08.287308,05/07/20,05:15:08
2984,Black Caviar Woman Paris Elysees - Perfume Feminino - Eau de Toilette,"69,00","58,90",,2020-05-07 05:15:08.287308,05/07/20,05:15:08
2657,Ange ou Démon Givenchy - Perfume Feminino - Eau de Parfum,"288,90","242,79","8x de R$ 30,34",2020-05-07 05:15:08.287308,05/07/20,05:15:08
2647,Amour Toujours Paris Elysees - Perfume Feminino - Eau de Toilette,"69,00","56,80",,2020-05-07 05:15:08.287308,05/07/20,05:15:08
2561,212 Vip Carolina Herrera - Perfume Feminino - Eau de Parfum,,"288,90","9x de R$ 32,10",2020-05-07 05:15:08.287308,05/07/20,05:15:08
2551,212 NYC Carolina Herrera - Perfume Feminino - Eau de Toilette,,"278,90","9x de R$ 30,98",2020-05-07 05:15:08.287308,05/07/20,05:15:08
1837,Rouge Royal Marina de Bourbon - Perfume Feminino - Eau de Parfum,"219,00","140,70","4x de R$ 35,17",2020-05-07 05:15:08.287308,05/07/20,05:15:08
1159,Midnight Fantasy Britney Spears - Perfume Feminino - Eau de Parfum,"284,00","218,68","7x de R$ 31,24",2020-05-07 05:15:08.287308,05/07/20,05:15:08
909,Light Blue Dolce&Gabbana - Perfume Feminino - Eau de Toilette,"275,80","234,43","7x de R$ 33,49",2020-05-07 05:15:08.287308,05/07/20,05:15:08
812,Laloa Sexy Via Paris - Perfume Feminino - Eau de Toilette,"53,00","39,00",,2020-05-07 05:15:08.287308,05/07/20,05:15:08
330,Gucci Guilty Gucci - Perfume Feminino - Eau de Toilette,"298,90","253,80","8x de R$ 31,72",2020-05-07 05:15:08.287308,05/07/20,05:15:08
38167,JOY Intense By Dior Perfume Feminino – Eau de Parfum,,"459,00","10x de R$ 45,90",2020-05-07 05:15:08.287308,05/07/20,05:15:08
38044,My Delicate La Rive – Perfume Feminino Eau de Parfum,"69,90","59,42",,2020-05-07 05:15:08.287308,05/07/20,05:15:08
37065,Nina Rouge Nina Ricci Perfume Feminino - Eau de Toilette,,"228,80","7x de R$ 32,68",2020-05-07 05:15:08.287308,05/07/20,05:15:08
36219,Woman Intense Ralph Lauren - Perfume Feminino Eau de Parfum,"398,80","299,79","9x de R$ 33,31",2020-05-07 05:15:08.287308,05/07/20,05:15:08
35796,Burberry Her Blossom Burberry Perfume Feminino - Eau de Toilette,"268,90","225,80","7x de R$ 32,25",2020-05-07 05:15:08.287308,05/07/20,05:15:08
35472,Aura Sensuelle Mugler Perfume Feminino - Eau de Parfum,"349,00","296,65","9x de R$ 32,96",2020-05-07 05:15:08.287308,05/07/20,05:15:08
34764,Terracotta Le Parfum Guerlain - Perfume Feminino Eau de Toilette,,"359,90","10x de R$ 35,99",2020-05-07 05:15:08.287308,05/07/20,05:15:08
34739,Mon Guerlain Bloom Of Rose - Perfume Feminino Eau de Toilette,,"230,00","7x de R$ 32,85",2020-05-07 05:15:08.287308,05/07/20,05:15:08
34734,Aqua Allegoria Ginger Piccante Guerlain - Perfume Feminino Eau de Toilette,,"334,90","10x de R$ 33,49",2020-05-07 05:15:08.287308,05/07/20,05:15:08
34729,Aqua Allegoria Pera Granita Guerlain - Perfume Feminino Eau de Toilette,,"334,90","10x de R$ 33,49",2020-05-07 05:15:08.287308,05/07/20,05:15:08
34728,Aqua Allegoria Limon Verde Guerlain - Perfume Feminino Eau de Toilette,,"334,90","10x de R$ 33,49",2020-05-07 05:15:08.287308,05/07/20,05:15:08
32883,Olympéa Legend Paco Rabanne Perfume Feminino - Eau de Parfum,,"398,90","10x de R$ 39,89",2020-05-07 05:15:08.287308,05/07/20,05:15:08
31685,J’adore Roller Pearl Dior Perfume Feminino - Eau de Parfum,,"199,00","6x de R$ 33,16",2020-05-07 05:15:08.287308,05/07/20,05:15:08
30398,Dolce & Sense Vanille/Framboise Paris Elysees Perfume Feminino - Eau de Parfum,"49,90","42,42",,2020-05-07 05:15:08.287308,05/07/20,05:15:08
30300,Black Opium Glow Yves Saint Laurent Perfume Feminino - Eau de Toilette,,"398,90","10x de R$ 39,89",2020-05-07 05:15:08.287308,05/07/20,05:15:08
29707,Romantic Glamour Paris Elysees - Perfume Feminino - Eau de Parfum,"74,00","55,50",,2020-05-07 05:15:08.287308,05/07/20,05:15:08
27626,Real Time Wonderful Woman - Perfume Feminino Eau de Parfum,"59,00","47,20",,2020-05-07 05:15:08.287308,05/07/20,05:15:08
27349,Paris La Nuit Fiorucci Perfume Feminino - Deo Colônia,,"49,90",,2020-05-07 05:15:08.287308,05/07/20,05:15:08
27054,Scandal by Night Jean Paul Gaultier Perfume Feminino - Eau de Parfum,,"348,90","10x de R$ 34,89",2020-05-07 05:15:08.287308,05/07/20,05:15:08
27004,Lavanda Phytoderm Perfume Feminino - Deo Colônia,"11,90","10,12",,2020-05-07 05:15:08.287308,05/07/20,05:15:08
24385,Cristal Royal Passion Marina de Bourbon - Perfume Feminino - Eau de Parfum,"229,00","139,00","4x de R$ 34,75",2020-05-07 05:15:08.287308,05/07/20,05:15:08
24050,Alien Flora Futura Mugler Perfume Feminino - Eau de Toilette,"278,90","199,80","6x de R$ 33,30",2020-05-07 05:15:08.287308,05/07/20,05:15:08
22549,Roller Pearl Dior Miss Dior Blooming Bouquet - Eau de Toilette,,"169,00","5x de R$ 33,80",2020-05-07 05:15:08.287308,05/07/20,05:15:08
20958,La Nuit Trésor à La Folie Lancôme - Perfume feminino - Eau de Parfum,,"378,90","10x de R$ 37,89",2020-05-07 05:15:08.287308,05/07/20,05:15:08
20569,Olympéa Aqua Paco Rabanne - Perfume Feminino - Eau de Parfum Légère,,"298,90","9x de R$ 33,21",2020-05-07 05:15:08.287308,05/07/20,05:15:08
18905,The One Dolce&Gabbana - Perfume Feminino - Eau de Toilette,"453,90","385,82","10x de R$ 38,58",2020-05-07 05:15:08.287308,05/07/20,05:15:08
18810,Gucci Bloom Gucci - Perfume Feminino - Eau de Parfum,"399,00","309,00","10x de R$ 30,90",2020-05-07 05:15:08.287308,05/07/20,05:15:08
18283,La Vie Est Belle L'Éclat Lancôme - Perfume Feminino - Eau de Parfum,,"298,90","9x de R$ 33,21",2020-05-07 05:15:08.287308,05/07/20,05:15:08
16632,Bamboo Gucci - Perfume Feminino Eau de Parfum,"299,00","249,00","8x de R$ 31,12",2020-05-07 05:15:08.287308,05/07/20,05:15:08
16573,O Desejo Juliana Paes - Perfume Feminino - Deo Colônia,"69,90","59,42",,2020-05-07 05:15:08.287308,05/07/20,05:15:08
15996,Angel Muse Mugler - Perfume Feminino - Eau de Parfum,"348,90","313,90","10x de R$ 31,39",2020-05-07 05:15:08.287308,05/07/20,05:15:08
15992,Olympéa Intense Paco Rabanne - Perfume Feminino - Eau de Parfum,,"328,90","10x de R$ 32,89",2020-05-07 05:15:08.287308,05/07/20,05:15:08
15794,Vanilla Blossom Monotheme - Perfume Feminino Eau de Toilette,"149,90","127,42","4x de R$ 31,85",2020-05-07 05:15:08.287308,05/07/20,05:15:08
14270,Lady Million Privé Paco Rabanne -  Feminino - Eau de Parfum,,"328,90","10x de R$ 32,89",2020-05-07 05:15:08.287308,05/07/20,05:15:08
13640,Wave For Her Hollister - Perfume Feminino - Eau de Parfum,"169,00","118,90","3x de R$ 39,63",2020-05-07 05:15:08.287308,05/07/20,05:15:08
13492,Secret I-scents - Perfume Feminino - Eau de Parfum,"39,80","33,80",,2020-05-07 05:15:08.287308,05/07/20,05:15:08
13491,Coretan I-scents - Perfume Feminino - Eau de Parfum,"37,80","32,13",,2020-05-07 05:15:08.287308,05/07/20,05:15:08
12757,Eau de Lacoste L.12.12 Pour Elle Sparkling Lacoste - Perfume Feminino - Eau de Toilette,"309,00","169,00","5x de R$ 33,80",2020-05-07 05:15:08.287308,05/07/20,05:15:08
11758,Mademoiselle Azzaro - Perfume Feminino - Eau de Toilette,"218,90","149,00","4x de R$ 37,25",2020-05-07 05:15:08.287308,05/07/20,05:15:08
9408,Majestic Pour Femme Fiorucci - Perfume Feminino - Deo Colônia,,"49,90",,2020-05-07 05:15:08.287308,05/07/20,05:15:08
8581,Anais Anais Premier Delice Cacharel - Perfume Feminino - Eau de Toilette,,"178,80","5x de R$ 35,76",2020-05-07 05:15:08.287308,05/07/20,05:15:08
8333,Madame In Love La Rive - Perfume Feminino - Eau de Parfum,"69,90","56,90",,2020-05-07 05:15:08.287308,05/07/20,05:15:08
8242,Boss Ma Vie Pour Femme Hugo Boss - Perfume Feminino - Eau de Parfum,"429,00","321,75","10x de R$ 32,17",2020-05-07 05:15:08.287308,05/07/20,05:15:08
7561,Classique Marina de Bourbon - Perfume Feminino - Eau de Parfum,"170,00","149,00","4x de R$ 37,25",2020-05-07 05:15:08.287308,05/07/20,05:15:08
5688,Miss Dior Blooming Bouquet Dior - Perfume Feminino - Eau de Toilette,,"279,00","9x de R$ 31,00",2020-05-07 05:15:08.287308,05/07/20,05:15:08
4614,Classic Jeans Forum - Perfume Unissex - Eau de Cologne,"69,90","55,92",,2020-05-07 05:15:08.287308,05/07/20,05:15:08
4253,Pacha Ibiza Rosé Pacha Ibiza - Perfume Feminino - Eau de Toilette,"98,90","79,00","2x de R$ 39,50",2020-05-07 05:15:08.287308,05/07/20,05:15:08
3984,Amani Code Pour Femme Giorgio Armani - Perfume Feminino - Eau de Parfum,,"438,90","10x de R$ 43,89",2020-05-07 05:15:08.287308,05/07/20,05:15:08
3979,Anais Anais L'Original Cacharel - Perfume Feminino - Eau de Toilette,,"258,80","8x de R$ 32,35",2020-05-07 05:15:08.287308,05/07/20,05:15:08
3965,Acqua Di Gioia Giorgio Armani - Perfume Feminino - Eau de Parfum,,"268,90","8x de R$ 33,61",2020-05-07 05:15:08.287308,05/07/20,05:15:08
3592,Dior Addict Dior - Perfume Feminino - Eau de Parfum,,"299,00","9x de R$ 33,22",2020-05-07 05:15:08.287308,05/07/20,05:15:08
3483,Daniella Sabrini Paris Elysees - Perfume Feminino - Eau de Toilette,"69,00","41,40",,2020-05-07 05:15:08.287308,05/07/20,05:15:08
3307,Classique Jean Paul Gaultier - Perfume Feminino - Eau de Toilette,,"319,00","10x de R$ 31,90",2020-05-07 05:15:08.287308,05/07/20,05:15:08
3306,Classique Jean Paul Gaultier - Perfume Feminino - Eau de Parfum,,"298,90","9x de R$ 33,21",2020-05-07 05:15:08.287308,05/07/20,05:15:08
2831,Baiser Volé Cartier - Perfume Feminino - Eau de Parfum,,"670,00","10x de R$ 67,00",2020-05-07 05:15:08.287308,05/07/20,05:15:08
1685,Pure Poison Dior - Perfume Feminino - Eau de Parfum,,"298,90","9x de R$ 33,21",2020-05-07 05:15:08.287308,05/07/20,05:15:08
1345,Number One Paris Elysees - Perfume Unissex - Eau de Toilette,"69,00","59,80",,2020-05-07 05:15:08.287308,05/07/20,05:15:08
1306,Nina Nina Ricci - Perfume Feminino - Eau de Toilette,,"119,00","3x de R$ 39,66",2020-05-07 05:15:08.287308,05/07/20,05:15:08
1195,Miss Vodka Paris Elysees - Perfume Feminino - Eau de Toilette,"69,00","55,20",,2020-05-07 05:15:08.287308,05/07/20,05:15:08
686,Kenzo Amour Kenzo - Perfume Feminino - Eau de Parfum,"249,80","212,33","7x de R$ 30,33",2020-05-07 05:15:08.287308,05/07/20,05:15:08
514,Hypnotic Poison Dior - Perfume Feminino - Eau de Toilette,,"425,00","10x de R$ 42,50",2020-05-07 05:15:08.287308,05/07/20,05:15:08
39217,Olympéa Onyx Paco Rabanne Perfume Feminino EDP,,"499,00","10x de R$ 49,90",2020-05-07 05:15:08.287308,05/07/20,05:15:08
39151,Flower by Kenzo Poppy Bouquet Kenzo Perfume Feminino - EDP,"259,00","220,15","7x de R$ 31,45",2020-05-07 05:15:08.287308,05/07/20,05:15:08
38968,Neon Man Colcci Perfume Feminino EDT,"119,90","101,92","3x de R$ 33,97",2020-05-07 05:15:08.287308,05/07/20,05:15:08
38897,Mon Guerlain Bloom of Rose - Guerlain Perfume Feminino EDP,,"265,00","8x de R$ 33,12",2020-05-07 05:15:08.287308,05/07/20,05:15:08
38820,La Belle Jean Paul Gaultier Perfume Feminino EDP,,"439,00","10x de R$ 43,90",2020-05-07 05:15:08.287308,05/07/20,05:15:08
38791,United Dreams Citrus for Her Benetton – Perfume Feminino EDT,,"119,00","3x de R$ 39,66",2020-05-07 05:15:08.287308,05/07/20,05:15:08
37560,Sky Di Gioia Giorgio Armani - Perfume feminino Eau de Parfum,,"368,80","10x de R$ 36,88",2020-05-07 05:15:08.287308,05/07/20,05:15:08
35843,Angel Eau Croisiere Mugler  Pefume Feminino-Eau de Toillete,"429,00","299,80","9x de R$ 33,31",2020-05-07 05:15:08.287308,05/07/20,05:15:08
34769,GB Blanc Vanilla Giovanna Baby Perfume Feminino - Deo Colônia,"52,45","47,21",,2020-05-07 05:15:08.287308,05/07/20,05:15:08
34765,Meteorites Le Parfum Guerlain - Perfume Feminino Eau de Toilette,,"359,90","10x de R$ 35,99",2020-05-07 05:15:08.287308,05/07/20,05:15:08
34749,Insolance Guerlain - Perfume Feminino Eau de Toilette,,"299,90","9x de R$ 33,32",2020-05-07 05:15:08.287308,05/07/20,05:15:08
34740,La Petite Robe Noire Guerlain - Perfume Feminino Eau de Toilette,,"250,00","8x de R$ 31,25",2020-05-07 05:15:08.287308,05/07/20,05:15:08
34738,Mon Guerlain - Perfume Feminino Eau de Toilette,,"230,00","7x de R$ 32,85",2020-05-07 05:15:08.287308,05/07/20,05:15:08
34737,Mon Guerlain Florale - Perfume Feminino Eau de Parfum,,"264,90","8x de R$ 33,11",2020-05-07 05:15:08.287308,05/07/20,05:15:08
34733,Aqua Allegoria Flora Cherrysia Guerlain - Perfume Feminino Eau de Toilette,,"334,90","10x de R$ 33,49",2020-05-07 05:15:08.287308,05/07/20,05:15:08
34732,Aqua Allegoria Passiflora Guerlain - Perfume Feminino Eau de Toilette,,"334,90","10x de R$ 33,49",2020-05-07 05:15:08.287308,05/07/20,05:15:08
34731,Aqua Allegoria Pamplelune Guerlain - Perfume Feminino Eau de Toilette,,"334,90","10x de R$ 33,49",2020-05-07 05:15:08.287308,05/07/20,05:15:08
34730,Aqua Allegoria Bergamota Calabria Guerlain - Perfume Feminino Eau de Toilette,,"334,90","10x de R$ 33,49",2020-05-07 05:15:08.287308,05/07/20,05:15:08
34230,Wanted Girl Azzaro - Perfume Feminino Eau de Parfum,"278,90","223,12","7x de R$ 31,87",2020-05-07 05:15:08.287308,05/07/20,05:15:08
34213,Have Fun La Rive Perfume Feminino - Eau de Parfum,"39,90","33,92",,2020-05-07 05:15:08.287308,05/07/20,05:15:08
33148,Animale Seduction Femme Animale - Perfume Feminino - Eau de Parfum,,"169,00","5x de R$ 33,80",2020-05-07 05:15:08.287308,05/07/20,05:15:08
32683,Kenzo World Collector Kenzo Perfume Feminino - Eau de Toilette,"378,90","227,34","7x de R$ 32,47",2020-05-07 05:15:08.287308,05/07/20,05:15:08
32370,Her Golden Secret Antonio Banderas - Perfume Feminino - Eau de Toilette,,"98,90","3x de R$ 32,96",2020-05-07 05:15:08.287308,05/07/20,05:15:08
31898,Majestic Esmeralda Fiorucci Perfume Feminino - Deo Colônia,"49,90","44,91",,2020-05-07 05:15:08.287308,05/07/20,05:15:08
30727,Prerogative Britney Spears - Perfume Feminino Eau de Parfum,"149,00","126,65","4x de R$ 31,66",2020-05-07 05:15:08.287308,05/07/20,05:15:08
30648,La Vie Este Belle En Rose Lancôme Perfume Feminino - Eau de Toilette,"498,90","373,90","10x de R$ 37,39",2020-05-07 05:15:08.287308,05/07/20,05:15:08
30402,Romantic Love Paris Elysees Perfume Feminino - Eau de Parfum,"74,90","59,92",,2020-05-07 05:15:08.287308,05/07/20,05:15:08
30396,Dolce & Sense Patchouli Paris Elysees Perfume Feminino - Eau de Parfum,"49,90","42,42",,2020-05-07 05:15:08.287308,05/07/20,05:15:08
30395,Dolce & Sense Muguet Paris Elysees Perfume Feminino - Eau de Parfum,"49,90","37,43",,2020-05-07 05:15:08.287308,05/07/20,05:15:08
30394,Dolce & Sense Jasmin Paris Elysees Perfume Feminino - Eau de Parfum,"49,90","42,42",,2020-05-07 05:15:08.287308,05/07/20,05:15:08
30336,La Vida Ciclo Cosméticos Perfume Feminino - Deo Colônia,"59,90","50,92",,2020-05-07 05:15:08.287308,05/07/20,05:15:08
29451,Pure XS For Her Paco Rabanne - Perfume Feminino Eau de Parfum,,"298,90","9x de R$ 33,21",2020-05-07 05:15:08.287308,05/07/20,05:15:08
26390,Jimmy Choo Fever Perfume Feminino Eau de Parfum,"299,00","237,90","7x de R$ 33,98",2020-05-07 05:15:08.287308,05/07/20,05:15:08
25317,La Femme L'Eau Prada -  Perfume Feminino - Eau de Toilette,"318,90","255,12","8x de R$ 31,89",2020-05-07 05:15:08.287308,05/07/20,05:15:08
22385,Lovely Night Puccini Perfume Feminino - Eau de Parfum,"185,00","157,15","5x de R$ 31,43",2020-05-07 05:15:08.287308,05/07/20,05:15:08
22035,Dylan Blue Pour Femme Versace - Perfume Feminino Eau de Parfum,"289,00","245,65","8x de R$ 30,70",2020-05-07 05:15:08.287308,05/07/20,05:15:08
21725,Splendeur Paris Fiorucci - Perfume Feminino - Deo Colônia,"49,90","42,42",,2020-05-07 05:15:08.287308,05/07/20,05:15:08
20576,Coup D’Amour Real Time Perfume Feminino - Eau de Parfum,"59,00","41,30",,2020-05-07 05:15:08.287308,05/07/20,05:15:08
20495,Because it's You She Giorgio Armani Perfume Feminino - Eau de Parfum,,"288,90","9x de R$ 32,10",2020-05-07 05:15:08.287308,05/07/20,05:15:08
19972,Kenzo World Kenzo Perfume Feminino - Eau de Toilette,"328,90","230,23","7x de R$ 32,89",2020-05-07 05:15:08.287308,05/07/20,05:15:08
19203,Dream Ana Hickmann - Perfume Feminino - Deo Colônia,"79,90","51,94",,2020-05-07 05:15:08.287308,05/07/20,05:15:08
18509,She Is Mine La Rive Perfume Feminino - Eau de Parfum,"69,90","54,90",,2020-05-07 05:15:08.287308,05/07/20,05:15:08
18048,Dance Diamonds Shakira - Perfume Feminino Eau de Toilette,,"79,90","2x de R$ 39,95",2020-05-07 05:15:08.287308,05/07/20,05:15:08
17716,Light Blue Pour Femme Intense Dolce&Gabbana Perfume Feminino - Eau de Parfum,"349,00","296,65","9x de R$ 32,96",2020-05-07 05:15:08.287308,05/07/20,05:15:08
17123,Cherry Giovanna Baby Perfume Feminino - Deo Colônia,"50,00","35,00",,2020-05-07 05:15:08.287308,05/07/20,05:15:08
17122,Candy Giovanna Baby Perfume Feminino - Deo Colônia,"50,00","40,00",,2020-05-07 05:15:08.287308,05/07/20,05:15:08
16752,Oui Je T’aime Linn Young - Perfume Femino Eau de Parfum,"92,00","71,90","2x de R$ 35,95",2020-05-07 05:15:08.287308,05/07/20,05:15:08
16520,La Nuit Trésor L’eau de Toilette Lancôme - Perfume Feminino - Eau de Toilette,,"388,90","10x de R$ 38,89",2020-05-07 05:15:08.287308,05/07/20,05:15:08
16401,Sensuelle Ulric de Varens - Perfume Feminino - Eau de Parfum,"109,00","75,90","2x de R$ 37,95",2020-05-07 05:15:08.287308,05/07/20,05:15:08
16028,J'adore Injoy Dior Perfume Feminino Eau de Toilette,,"425,00","10x de R$ 42,50",2020-05-07 05:15:08.287308,05/07/20,05:15:08
15656,Splash Alfazema Green Fiorucci - Perfume Feminino - Deo Colônia,"23,90","21,51",,2020-05-07 05:15:08.287308,05/07/20,05:15:08
15466,La Vie Est Belle Intense Lancôme - Perfume Feminino - L’Eau de Parfum,,"398,90","10x de R$ 39,89",2020-05-07 05:15:08.287308,05/07/20,05:15:08
14585,Versace Eros Pour Femme Versace - Perfume Feminino - Eau de Toilette,"239,00","203,15","6x de R$ 33,85",2020-05-07 05:15:08.287308,05/07/20,05:15:08
14193,Shakira Dance Shakira - Perfume Feminino - Eau de Toilette,,"78,90","2x de R$ 39,45",2020-05-07 05:15:08.287308,05/07/20,05:15:08
13959,Narciso Poudree Narciso Rodriguez -  Feminino - Eau de Parfum,"404,80","343,80","10x de R$ 34,38",2020-05-07 05:15:08.287308,05/07/20,05:15:08
13775,Carven L’Absolu Carven -  Feminino - Eau de Parfum,"299,00","179,40","5x de R$ 35,88",2020-05-07 05:15:08.287308,05/07/20,05:15:08
13129,Elie Saab Le Parfum Rose Couture Elie Saab - Perfume Feminino - Eau de Toilette,"299,00","209,30","6x de R$ 34,88",2020-05-07 05:15:08.287308,05/07/20,05:15:08
12747,The One Essence Dolce&Gabbana- Perfume Feminino - Eau de Parfum,"599,00","359,40","10x de R$ 35,94",2020-05-07 05:15:08.287308,05/07/20,05:15:08
12058,Unique for Women Lonkoom - Perfume Feminino - Eau de Parfum,,"94,90","3x de R$ 31,63",2020-05-07 05:15:08.287308,05/07/20,05:15:08
11447,Live Irrésistible Givenchy - Perfume Feminino - Eau de Parfum,"288,90","231,90","7x de R$ 33,12",2020-05-07 05:15:08.287308,05/07/20,05:15:08
10644,Varensia White Ulric de Varens - Perfume Feminino - Eau de Parfum,"89,00","73,80","2x de R$ 36,90",2020-05-07 05:15:08.287308,05/07/20,05:15:08
10619,Donna Fiorucci - Perfume Feminino - Deo Colônia,,"39,90",,2020-05-07 05:15:08.287308,05/07/20,05:15:08
9438,Golden Fiorucci - Perfume Feminino - Deo Colônia,"39,90","33,92",,2020-05-07 05:15:08.287308,05/07/20,05:15:08
9392,Pacha Ibiza Queen Sexy Pacha Ibiza - Perfume Feminino - Eau de Toilette,"98,90","79,90","2x de R$ 39,95",2020-05-07 05:15:08.287308,05/07/20,05:15:08
9223,Love Story Chloé - Perfume Feminino - Eau de Parfum,"499,00","424,15","10x de R$ 42,41",2020-05-07 05:15:08.287308,05/07/20,05:15:08
8693,L'Extase Nina Ricci - Perfume Feminino - Eau de Parfum,,"268,90","8x de R$ 33,61",2020-05-07 05:15:08.287308,05/07/20,05:15:08
8687,Just for Me Linn Young - Perfume Feminino - Eau de Parfum,,"63,80","2x de R$ 31,90",2020-05-07 05:15:08.287308,05/07/20,05:15:08
8612,Brit Rhythm Floral Burberry - Perfume Feminino - Eau de Toilette,"269,00","215,20","7x de R$ 30,74",2020-05-07 05:15:08.287308,05/07/20,05:15:08
8507,Dahlia Divin Givenchy - Perfume Feminino - Eau de Parfum,"288,90","245,57","8x de R$ 30,69",2020-05-07 05:15:08.287308,05/07/20,05:15:08
8441,Beauty Lonkoom - Perfume Feminino - Eau de Parfum,,"94,90","3x de R$ 31,63",2020-05-07 05:15:08.287308,05/07/20,05:15:08
8331,Emotion Woman La Rive - Perfume Feminino - Eau de Toilette,"69,90","53,90",,2020-05-07 05:15:08.287308,05/07/20,05:15:08
8291,Dior Miss Dior Hair Mist - Perfume para os Cabelos,"215,00","214,90","7x de R$ 30,70",2020-05-07 05:15:08.287308,05/07/20,05:15:08
7970,Coco Demer Adelante - Perfume Feminino - Eau de Parfum,"65,10","39,06",,2020-05-07 05:15:08.287308,05/07/20,05:15:08
7969,Couer Demer V da marca Adelante - Perfume Feminino - Eau de Parfum,"65,10","39,06",,2020-05-07 05:15:08.287308,05/07/20,05:15:08
7950,Doriane Paris Bleu - Perfume Feminino - Eau de Parfum,,"76,80","2x de R$ 38,40",2020-05-07 05:15:08.287308,05/07/20,05:15:08
7143,United Dreams Live Free Benetton - Perfume Feminino - Eau de Toilette,,"159,00","5x de R$ 31,80",2020-05-07 05:15:08.287308,05/07/20,05:15:08
6439,The Vert 1902 - Perfume Unissex - Eau de Cologne,"99,00","80,91","2x de R$ 40,45",2020-05-07 05:15:08.287308,05/07/20,05:15:08
6239,Roses de Chloé Chloé - Perfume Feminino - Eau de Toilette,"299,00","254,15","8x de R$ 31,76",2020-05-07 05:15:08.287308,05/07/20,05:15:08
5646,Varens Je t'aime Ulric de Varens - Perfume Feminino - Eau de Parfum,,"109,00","3x de R$ 36,33",2020-05-07 05:15:08.287308,05/07/20,05:15:08
4867,Forum Lavanda Forum - Perfume Feminino - Deo Colônia,"119,90","95,80","3x de R$ 31,93",2020-05-07 05:15:08.287308,05/07/20,05:15:08
4865,Forum Jeans in Blue Forum  - Perfume Feminino - Eau de Parfum,"109,00","79,00","2x de R$ 39,50",2020-05-07 05:15:08.287308,05/07/20,05:15:08
4748,A Wish Lonkoom - Perfume Feminino - Eau de Parfum,,"159,90","5x de R$ 31,98",2020-05-07 05:15:08.287308,05/07/20,05:15:08
4241,Noa Cacharel - Perfume Feminino - Eau de Toilette,,"348,90","10x de R$ 34,89",2020-05-07 05:15:08.287308,05/07/20,05:15:08
3686,Doline In Love Via Paris - Perfume Feminino - Eau de Toilette,"53,00","47,90",,2020-05-07 05:15:08.287308,05/07/20,05:15:08
3264,Ck Be Calvin Klein - Perfume Unissex - Eau de Toilette,"259,00","193,80","6x de R$ 32,30",2020-05-07 05:15:08.287308,05/07/20,05:15:08
2853,Be Delicious Fresh Blossom Dkny - Perfume Feminino - Eau de Parfum,,"289,00","9x de R$ 32,11",2020-05-07 05:15:08.287308,05/07/20,05:15:08
2675,Animale Animale - Perfume Feminino - Eau de Parfum,,"142,90","4x de R$ 35,72",2020-05-07 05:15:08.287308,05/07/20,05:15:08
2658,Ange ou Démon Le Secret Givenchy - Perfume Feminino - Eau de Parfum,"288,90","245,57","8x de R$ 30,69",2020-05-07 05:15:08.287308,05/07/20,05:15:08
2645,Amarige Givenchy - Perfume Feminino - Eau de Toilette,"488,90","415,57","10x de R$ 41,55",2020-05-07 05:15:08.287308,05/07/20,05:15:08
1709,Quartz Pour Femme Molyneux - Perfume Feminino - Eau de Parfum,"109,00","88,80","2x de R$ 44,40",2020-05-07 05:15:08.287308,05/07/20,05:15:08
1433,Organza Givenchy - Perfume Feminino - Eau de Parfum,"528,90","449,57","10x de R$ 44,95",2020-05-07 05:15:08.287308,05/07/20,05:15:08
1185,Miss Dior Dior - Perfume Feminino - Eau de Toilette,,"425,00","10x de R$ 42,50",2020-05-07 05:15:08.287308,05/07/20,05:15:08
1051,Mademoiselle Ricci Nina Ricci - Perfume Feminino - Eau de Parfum,,"248,90","8x de R$ 31,11",2020-05-07 05:15:08.287308,05/07/20,05:15:08
672,Jungle L´elephant Kenzo - Perfume Feminino - Eau de Parfum,"258,90","220,07","7x de R$ 31,43",2020-05-07 05:15:08.287308,05/07/20,05:15:08
39049,Omnia Coral Bvlgari Perfume Feminino EDT,,"279,00","9x de R$ 31,00",2020-05-07 05:15:08.287308,05/07/20,05:15:08
38881,Sexy Amber Michael Kors - Perfume Feminino EDP,,"449,00","10x de R$ 44,90",2020-05-07 05:15:08.287308,05/07/20,05:15:08
38693,Splendida Magnólia Sensuel BVLGARI Perfume Feminino EDP,,"399,00","10x de R$ 39,90",2020-05-07 05:15:08.287308,05/07/20,05:15:08
38692,Splendida Jasmin Noir BVLGARI Perfume Feminino EDP,,"399,00","10x de R$ 39,90",2020-05-07 05:15:08.287308,05/07/20,05:15:08
37566,Guilty Femme Gucci - Perfume Feminino - Eau de Parfum,"529,00","449,00","10x de R$ 44,90",2020-05-07 05:15:08.287308,05/07/20,05:15:08
37564,Nina Ricci Edição de Colecionador Nina Ricci EDT 50 ml,,"299,00","9x de R$ 33,22",2020-05-07 05:15:08.287308,05/07/20,05:15:08
37229,Sereia Mystic Line Fiorucci Perfume Feminino – Deo Colônia,"54,90","48,31",,2020-05-07 05:15:08.287308,05/07/20,05:15:08
35367,Queen of Seduction Dose Antonio Banderas - Perfume Feminino Eau de Toilette,,"69,90","2x de R$ 34,95",2020-05-07 05:15:08.287308,05/07/20,05:15:08
35035,Kenzo Power Kenzo Perfume Feminino - Eau de Parfum,"378,90","265,23","8x de R$ 33,15",2020-05-07 05:15:08.287308,05/07/20,05:15:08
34991,Festival Nite For Her Hollister Perfume Feminino - Eau de Parfum,"159,00","111,30","3x de R$ 37,10",2020-05-07 05:15:08.287308,05/07/20,05:15:08
34990,Authentic Woman Abercrombie & Fitch Perfume Feminino - Eau de Parfum,,"259,00","8x de R$ 32,37",2020-05-07 05:15:08.287308,05/07/20,05:15:08
34924,Armani Code Absolu Giorgio Armani Perfume Feminino - Eau de Parfum,,"298,90","9x de R$ 33,21",2020-05-07 05:15:08.287308,05/07/20,05:15:08
34767,Shalimar Souffle Guerlain - Perfume Feminino Eau de Parfum,,"489,90","10x de R$ 48,99",2020-05-07 05:15:08.287308,05/07/20,05:15:08
34753,Samsara Guerlain - Perfume Feminino Eau de Toilette,,"399,90","10x de R$ 39,99",2020-05-07 05:15:08.287308,05/07/20,05:15:08
